[
  {
    "original_op_input_details": {
      "sector_id": 1,
      "op_title": "Initialize Jekyll Forge Scaffolding & Configuration",
      "op_type": "DEV",
      "primary_deliverable": "The standard Jekyll file structure (`_layouts`, `_data`, etc.) and a configured `_config.yml` file are established within the main repository, ready for development.",
      "sector_name_for_prompt": "Forge Scaffolding & Data Ingress"
    },
    "llm_generated_data": {
      "issue_title": "PORT-DEV-001 Initialize Jekyll Forge Scaffolding & Configuration",
      "issue_labels": [
        "dev",
        "Context:PERS",
        "personal-dev",
        "help wanted",
        "foundational-op",
        "Jekyll",
        "static-site"
      ],
      "assignee": "Kin-Caid",
      "parent_project": "Automated Portfolio Website",
      "objective": "To establish the foundational Jekyll scaffolding and configuration within the repository, enabling future content development.",
      "deliverables": [
        "Standard Jekyll file structure (_layouts, _data, _posts, etc.) established in the main repository.",
        "A base _config.yml file configured with essential settings.",
        "Initial placeholder content (e.g., index.md) to verify successful setup."
      ],
      "associated_skills": [
        "Jekyll",
        "YAML configuration",
        "Markdown",
        "Git version control",
        "Static site generation"
      ],
      "awarded_guild_seal": "GS-DEV-Jekyll-Forge-Scaffolding-Configuration-v1",
      "context_background": "This operation is crucial for establishing the foundational architecture for the Automated Portfolio Website, enabling subsequent content and feature development.",
      "estimated_effort": "Medium",
      "verification_criteria": [
        "Jekyll build process completes without errors.",
        "The generated _site directory contains the expected static files.",
        "_config.yml contains specified base settings (e.g., site title, permalinks)."
      ],
      "notes_for_operatives": "Ensure all work is committed to a dedicated feature branch (e.g., `feature/guild-op-[ISSUE_NUMBER]`). Document progress in `Context Compilations` within `archives/PORT-DEV-001/`. Close this issue upon completion to trigger associated Guild automations.",
      "scribes_generation_notes": "Deliverables expanded from primary. `parent_project` value taken literally as per instruction.",
      "full_markdown_body": "# Guild Op: PORT-DEV-001 Initialize Jekyll Forge Scaffolding & Configuration\n\n## Category: DEV\n## Parent Project: Automated Portfolio Website\n## Assignees: @Kin-Caid\n\n## Objective:\nTo establish the foundational Jekyll scaffolding and configuration within the repository, enabling future content development.\n\n## Deliverables:\n- Standard Jekyll file structure (_layouts, _data, _posts, etc.) established in the main repository.\n- A base _config.yml file configured with essential settings.\n- Initial placeholder content (e.g., index.md) to verify successful setup.\n\n## Associated Skills:\n- Jekyll\n- YAML configuration\n- Markdown\n- Git version control\n- Static site generation\n\n## Awarded Guild Seal:\nGS-DEV-Jekyll-Forge-Scaffolding-Configuration-v1\n\n## Context & Background:\nThis operation is crucial for establishing the foundational architecture for the Automated Portfolio Website, enabling subsequent content and feature development.\n\n## Estimated Effort:\nMedium\n\n## Verification/Acceptance Criteria:\n- Jekyll build process completes without errors.\n- The generated _site directory contains the expected static files.\n- _config.yml contains specified base settings (e.g., site title, permalinks).\n\n---\n\n## Notes for Operatives:\n- Ensure all work is committed to a dedicated feature branch (e.g., `feature/guild-op-[ISSUE_NUMBER]`). Document progress in `Context Compilations` within `archives/PORT-DEV-001/`. Close this issue upon completion to trigger associated Guild automations."
    },
    "generation_status": "success"
  },
  {
    "original_op_input_details": {
      "sector_id": 1,
      "op_title": "Scribe the Data Ingress Script for Local Development",
      "op_type": "DEV",
      "primary_deliverable": "A shell script (`scripts/sync_registry.sh`) that reliably copies the `operative_registry.json` from its source into the Jekyll project's `_data` directory.",
      "sector_name_for_prompt": "Forge Scaffolding & Data Ingress"
    },
    "llm_generated_data": {
      "issue_title": "PORT-DEV-002 Scribe Data Ingress Script",
      "issue_labels": [
        "dev",
        "Context:PERS",
        "personal-dev",
        "help wanted",
        "foundational-op",
        "scripting",
        "data-management"
      ],
      "assignee": "Kin-Caid",
      "parent_project": "Automated Portfolio Website",
      "objective": "To create a robust shell script for automating the local data ingress process, ensuring `operative_registry.json` is correctly integrated into the Jekyll project for development.",
      "deliverables": [
        "A shell script (`scripts/sync_registry.sh`) that reliably copies `operative_registry.json` from its source into the Jekyll project's `_data` directory.",
        "Clear usage instructions for the `sync_registry.sh` script, including any prerequisites.",
        "Confirmation of successful data ingress for local development environments."
      ],
      "associated_skills": [
        "Shell scripting",
        "File system operations",
        "Jekyll project structure",
        "Data synchronization",
        "Automation scripting"
      ],
      "awarded_guild_seal": "GS-DEV-Data-Ingress-Script-Local-Development-v1",
      "context_background": "This operation is crucial for establishing a consistent and automated local development environment, specifically for handling the `operative_registry.json` data required by the Jekyll project. It falls under the Forge Scaffolding & Data Ingress sector.",
      "estimated_effort": "Medium",
      "verification_criteria": [
        "The `scripts/sync_registry.sh` script executes without errors.",
        "The `operative_registry.json` file is successfully copied to the Jekyll project's `_data` directory.",
        "Jekyll site generation reflects the synced `operative_registry.json` data locally and accurately."
      ],
      "notes_for_operatives": "Ensure all work is committed to a dedicated feature branch (e.g., `feature/guild-op-[ISSUE_NUMBER]`). Document progress in `Context Compilations` within `archives/PORT-DEV-002/`. Close this issue upon completion to trigger associated Guild automations.",
      "scribes_generation_notes": "Generated based on provided input. Assumed 'Medium' effort for robustness and inferred 'scripting', 'data-management' labels from the task description.",
      "full_markdown_body": "# Guild Op: PORT-DEV-002 Scribe Data Ingress Script\n\n## Category: DEV\n## Parent Project: Automated Portfolio Website\n## Assignees: @Kin-Caid\n\n## Objective:\nTo create a robust shell script for automating the local data ingress process, ensuring `operative_registry.json` is correctly integrated into the Jekyll project for development.\n\n## Deliverables:\n- A shell script (`scripts/sync_registry.sh`) that reliably copies `operative_registry.json` from its source into the Jekyll project's `_data` directory.\n- Clear usage instructions for the `sync_registry.sh` script, including any prerequisites.\n- Confirmation of successful data ingress for local development environments.\n\n## Associated Skills:\n- Shell scripting\n- File system operations\n- Jekyll project structure\n- Data synchronization\n- Automation scripting\n\n## Awarded Guild Seal:\nGS-DEV-Data-Ingress-Script-Local-Development-v1\n\n## Context & Background:\nThis operation is crucial for establishing a consistent and automated local development environment, specifically for handling the `operative_registry.json` data required by the Jekyll project. It falls under the Forge Scaffolding & Data Ingress sector.\n\n## Estimated Effort:\nMedium\n\n## Verification/Acceptance Criteria:\n- The `scripts/sync_registry.sh` script executes without errors.\n- The `operative_registry.json` file is successfully copied to the Jekyll project's `_data` directory.\n- Jekyll site generation reflects the synced `operative_registry.json` data locally and accurately.\n\n---\n\n## Notes for Operatives:\n- Ensure all work is committed to a dedicated feature branch (e.g., `feature/guild-op-[ISSUE_NUMBER]`). Document progress in `Context Compilations` within `archives/PORT-DEV-002/`. Close this issue upon completion to trigger associated Guild automations."
    },
    "generation_status": "success"
  },
  {
    "original_op_input_details": {
      "sector_id": 1,
      "op_title": "Codify the Local Forge Setup & Execution Protocol",
      "op_type": "DOC",
      "primary_deliverable": "A markdown file (`DEV_SETUP.md`) detailing the precise steps to install dependencies, run the data ingress script, and serve the Jekyll site locally.",
      "sector_name_for_prompt": "Forge Scaffolding & Data Ingress"
    },
    "llm_generated_data": {
      "issue_title": "PORT-DOC-001 Codify Local Forge Setup Protocol",
      "issue_labels": [
        "doc",
        "Context:PERS",
        "personal-dev",
        "help wanted",
        "foundational-op",
        "documentation",
        "setup"
      ],
      "assignee": "Kin-Caid",
      "parent_project": "Automated Portfolio Website",
      "objective": "To clearly document the local development environment setup, data ingress procedures, and Jekyll site serving protocol for the Forge project.",
      "deliverables": [
        "A comprehensive DEV_SETUP.md file.",
        "Step-by-step instructions for dependency installation.",
        "Detailed guide for running the data ingress script locally.",
        "Protocol for serving the Jekyll site in a local environment."
      ],
      "associated_skills": [
        "Markdown documentation",
        "Jekyll",
        "Data Ingress",
        "Dependency Management",
        "Technical Writing"
      ],
      "awarded_guild_seal": "GS-DOC-Local-Forge-Setup-Protocol-v1",
      "context_background": "This operation is crucial for standardizing the local development environment for the Forge project, ensuring consistent setup across all operatives and facilitating onboarding.",
      "estimated_effort": "Medium",
      "verification_criteria": [
        "DEV_SETUP.md is created and accessible.",
        "Local setup instructions (dependencies, ingress, Jekyll serve) can be followed by a new operative to successfully run the site locally.",
        "Documentation is clear, concise, and free of errors."
      ],
      "notes_for_operatives": "Ensure all work is committed to a dedicated feature branch (e.g., `feature/guild-op-[ISSUE_NUMBER]`). Document progress in `Context Compilations` within `archives/PORT-DOC-001/`. Close this issue upon completion to trigger associated Guild automations.",
      "scribes_generation_notes": "Generated based on provided input. Deliverables expanded for clarity. Inferred 'foundational-op' label due to protocol codification.",
      "full_markdown_body": "# Guild Op: PORT-DOC-001 Codify Local Forge Setup Protocol\n\n## Category: DOC\n## Parent Project: Automated Portfolio Website\n## Assignees: @Kin-Caid\n\n## Objective:\nTo clearly document the local development environment setup, data ingress procedures, and Jekyll site serving protocol for the Forge project.\n\n## Deliverables:\n- A comprehensive DEV_SETUP.md file.\n- Step-by-step instructions for dependency installation.\n- Detailed guide for running the data ingress script locally.\n- Protocol for serving the Jekyll site in a local environment.\n\n## Associated Skills:\n- Markdown documentation\n- Jekyll\n- Data Ingress\n- Dependency Management\n- Technical Writing\n\n## Awarded Guild Seal:\nGS-DOC-Local-Forge-Setup-Protocol-v1\n\n## Context & Background:\nThis operation is crucial for standardizing the local development environment for the Forge project, ensuring consistent setup across all operatives and facilitating onboarding.\n\n## Estimated Effort:\nMedium\n\n## Verification/Acceptance Criteria:\n- DEV_SETUP.md is created and accessible.\n- Local setup instructions (dependencies, ingress, Jekyll serve) can be followed by a new operative to successfully run the site locally.\n- Documentation is clear, concise, and free of errors.\n\n---\n\n## Notes for Operatives:\n- Ensure all work is committed to a dedicated feature branch (e.g., `feature/guild-op-[ISSUE_NUMBER]`). Document progress in `Context Compilations` within `archives/PORT-DOC-001/`. Close this issue upon completion to trigger associated Guild automations."
    },
    "generation_status": "success"
  },
  {
    "original_op_input_details": {
      "sector_id": 1,
      "op_title": "Conduct Data Ingress Verification Rite",
      "op_type": "QAT",
      "primary_deliverable": "A context compilation log with screenshots confirming that data from `operative_registry.json` can be successfully accessed and rendered on a test page, validating the entire Sector 1 pipeline.",
      "sector_name_for_prompt": "Forge Scaffolding & Data Ingress"
    },
    "llm_generated_data": {
      "issue_title": "PORT-QAT-001 Conduct Data Ingress Verification",
      "issue_labels": [
        "qat",
        "Context:PERS",
        "personal-dev",
        "help wanted",
        "foundational-op",
        "data-validation",
        "testing"
      ],
      "assignee": "Kin-Caid",
      "parent_project": "Automated Portfolio Website",
      "objective": "To meticulously verify the successful ingress and rendering of critical operative data from `operative_registry.json`, ensuring the integrity and functionality of the entire Sector 1 data pipeline.",
      "deliverables": [
        "Context compilation log documenting successful data access from `operative_registry.json`.",
        "Screenshots confirming `operative_registry.json` data rendering on a designated test page.",
        "Validation report confirming the integrity and functionality of the Sector 1 data pipeline."
      ],
      "associated_skills": [
        "Data validation",
        "Web testing",
        "JSON parsing",
        "Documentation (Markdown)",
        "Screenshot capture"
      ],
      "awarded_guild_seal": "GS-QAT-Data-Ingress-Verification-v1",
      "context_background": "This operation is crucial for the `Forge Scaffolding & Data Ingress` sector, specifically verifying the initial data ingress pipeline for operative information, ensuring foundational data access for the portfolio.",
      "estimated_effort": "Medium",
      "verification_criteria": [
        "The `context compilation log` comprehensively details steps taken and outcomes, including any encountered anomalies.",
        "Screenshots clearly depict `operative_registry.json` data correctly displayed and accessible on the test page.",
        "Confirmation that `operative_registry.json` data is accessible and renderable, validating Sector 1 pipeline integrity."
      ],
      "notes_for_operatives": "Ensure all work is committed to a dedicated feature branch (e.g., `feature/guild-op-[ISSUE_NUMBER]`). Document progress in `Context Compilations` within `archives/PORT-QAT-001/`. Close this issue upon completion to trigger associated Guild automations.",
      "scribes_generation_notes": "Deliverables expanded and specific skills inferred based on Op Type and Primary Deliverable. 'Automated Portfolio Website' used as parent project as per instruction.",
      "full_markdown_body": "# Guild Op: PORT-QAT-001 Conduct Data Ingress Verification\n\n## Category: QAT\n## Parent Project: Automated Portfolio Website\n## Assignees: @Kin-Caid\n\n## Objective:\nTo meticulously verify the successful ingress and rendering of critical operative data from `operative_registry.json`, ensuring the integrity and functionality of the entire Sector 1 data pipeline.\n\n## Deliverables:\n- Context compilation log documenting successful data access from `operative_registry.json`.\n- Screenshots confirming `operative_registry.json` data rendering on a designated test page.\n- Validation report confirming the integrity and functionality of the Sector 1 data pipeline.\n\n## Associated Skills:\n- Data validation\n- Web testing\n- JSON parsing\n- Documentation (Markdown)\n- Screenshot capture\n\n## Awarded Guild Seal:\nGS-QAT-Data-Ingress-Verification-v1\n\n## Context & Background:\nThis operation is crucial for the `Forge Scaffolding & Data Ingress` sector, specifically verifying the initial data ingress pipeline for operative information, ensuring foundational data access for the portfolio.\n\n## Estimated Effort:\nMedium\n\n## Verification/Acceptance Criteria:\n- The `context compilation log` comprehensively details steps taken and outcomes, including any encountered anomalies.\n- Screenshots clearly depict `operative_registry.json` data correctly displayed and accessible on the test page.\n- Confirmation that `operative_registry.json` data is accessible and renderable, validating Sector 1 pipeline integrity.\n\n---\n\n## Notes for Operatives:\n- Ensure all work is committed to a dedicated feature branch (e.g., `feature/guild-op-[ISSUE_NUMBER]`). Document progress in `Context Compilations` within `archives/PORT-QAT-001/`. Close this issue upon completion to trigger associated Guild automations."
    },
    "generation_status": "success"
  }
]